{
  "bodyFingerprint": "98845b4bae75e14b14562cd3ef8ddf6de621a392122d6b4d3128c9d1c289ae3d",
  "documentId": "package-context.packaging",
  "frontMatterFingerprint": "eb984998f016603aed76af9d5ade7ab7d0b41126072205d16d42d487001c7083",
  "sourceFingerprint": "a3d5532dd40b0332db1dd0ba422673703c61ce374747f2e7201a32b3f8b514bb"
}
