{
  "bodyFingerprint": "58804b19913386e554022f484ea9cccd80afd73d7eac3f0528c1360a16d23674",
  "documentId": "package-context.determinism",
  "frontMatterFingerprint": "447a6001eb55316d4ab0f5f6dd49ed6d19a5cf6b878ceb59dc7fd4332628baa2",
  "sourceFingerprint": "d3f28386b37d1b7e09cd89ab0a680a1b521181369a20792bf8bf61be205f5b3e"
}
