{
  "bodyFingerprint": "3dabc6416ba475d543108f885f0c00bda1e8b4e2f04c22dc20e38325d7b4e3bc",
  "documentId": "package-context.verification-and-gaps",
  "frontMatterFingerprint": "2b4cb398225a928009080f44430c61f12a63ff415ca6d5c52823de70a1222b8a",
  "sourceFingerprint": "ac27f380606d53371015b360d744b5afeeecab16573707fed895b1f71959f7de"
}
