{
  "bodyFingerprint": "55e9374ac4eb4d94896aa392b705c6938d3518223396d3fdb7de129a87ad19b1",
  "documentId": "package-context.capabilities",
  "frontMatterFingerprint": "6e63352ab10e89b1b05276e54018596eb07f01ff950f04cfe8ca986d4935d830",
  "sourceFingerprint": "bdb2b8bc83ef0a98bcc642f8587db7dd99b53d5d341ac27699525360a5eea5c1"
}
