{
  "bodyFingerprint": "2c034c7224ca693710eedbc1750fb7235b8c415998184c959c6d85e34da8db79",
  "documentId": "package-context.enforcement-boundary",
  "frontMatterFingerprint": "7b988f0e3d1e23952712a74794bd1eb46492d6f69ce2923833127be4468a0ee3",
  "sourceFingerprint": "daf26ff2fae564c01c00c929ab75e187db0c3fca117af03d042c4b32ef645bb2"
}
