{
  "bodyFingerprint": "f04f167e6014ddcd3709505c73c51d39376fb8a1a4481e4d00cc93709ddcdbb4",
  "documentId": "package-context.scope-authorization",
  "frontMatterFingerprint": "8b19731c08989b5294ada27796c5a7055e33352ea96d85905f01aed50ce529a0",
  "sourceFingerprint": "9a9a8cdf512c0a559f65cb08725a24e7d224c24680fbb591e8384f510a3afac7"
}
