{
  "bodyFingerprint": "721dc183ffeead8771f257ae94d659647cd93846073861de6b0c12412fe29f4a",
  "documentId": "package-context.packaging",
  "frontMatterFingerprint": "eb984998f016603aed76af9d5ade7ab7d0b41126072205d16d42d487001c7083",
  "sourceFingerprint": "a1a534fc5bb70b1649af4e54d648c82f296ed18b0decc25178b732fa860e4a7f"
}
