{
  "bodyFingerprint": "f57af5fdc81f032aa60533255ce7e1cea427f8ba04747781909d00f07808fdad",
  "documentId": "package-context.roles-and-briefs",
  "frontMatterFingerprint": "77b27d7549ef59b63579f32ffba23571f15fa90587bd48e1c19b82c1cf2bd311",
  "sourceFingerprint": "eaf54515e63aac5aa4feab3b217564e6b3ca38da53ceee26cc4201b31f712e9c"
}
