{
  "bodyFingerprint": "cd7fe649972a97ad9c4f97fc3edd9848e6673b974ed4263e81b94a10303a925c",
  "documentId": "package-context.verification-and-gaps",
  "frontMatterFingerprint": "86732f816d01391ead50b30b9f6950c7be30bfb0c4d87369094d51ece9943378",
  "sourceFingerprint": "39deee86f8f81731d0db6d1e70ac8ac316462c8b342759ea5491a446fdc4544a"
}
