{
  "bodyFingerprint": "dce163ec5ec568c4b1f76fe976867099ee381e6ae4f3429a2f52473a5e8bc236",
  "documentId": "package-context.roles-and-briefs",
  "frontMatterFingerprint": "a07a6ad0cd9b87c2bd63a7f58c0d29ac3174038e712f701d2614a869e072eea0",
  "sourceFingerprint": "65821ae1bbeb75c06ca3c52ecaa60c43f29ddf69de5eab781722882d4954a45c"
}
