{
  "bodyFingerprint": "063fbb18ff0bb038c7f91665cdcff0678b7bd85d80848c300a94fc8a8be1e8c7",
  "documentId": "package-context.wire-contract",
  "frontMatterFingerprint": "b0cb445565c68a72e3beddd43682c817e2e0dc690de6bfdac08df1f992390bae",
  "sourceFingerprint": "faa581197156095d5d2f3e4751dd597d6d15865af036eacccf34f6cb8ca4249f"
}
