{
  "bodyFingerprint": "3e0ff6e9e0a155848527b4e0a0d52ca76766ce4c94dad3ba499805f99d6e4357",
  "documentId": "package-context.capabilities",
  "frontMatterFingerprint": "d9c1642148e360f9b4dcc0b9f7c2c09c3afbf8b84ec683fa5e489b48001df8b0",
  "sourceFingerprint": "f574661ff74d6361c21d4ae79a03d31644e9ba46447370977cd0c4f5f020cabd"
}
