{
  "bodyFingerprint": "ecefedea7ce63901f1260fcdd3e0d814729611041d76640213723617a357df52",
  "documentId": "package-context.build-and-acceptance",
  "frontMatterFingerprint": "4cb671ed6dc2b8bcd8948520403d67bf1cb6480251c5295ee799091141da23f6",
  "sourceFingerprint": "5064f086cb85ddcf0676d99d9b5d51b429121e39e6509ba26b56be42dfac1634"
}
