{
  "bodyFingerprint": "0d93e2d0a11afdbefbb859a8e572c83fc94a61f2d374a358f87a68fe40e26f84",
  "documentId": "package-context.scratch-lifecycle",
  "frontMatterFingerprint": "a24860d5ee177beedd3f5b76a2744e335ee016abfa88a9b9a432b77f1316af15",
  "sourceFingerprint": "71407ac4987acce5c0dbe087dc4bdffa9d8ccd75d6293af699308316d2acd404"
}
