{
  "bodyFingerprint": "037efb2cae2c752568f8e96958485da22113fc1dd9877f51e55a0e4add04505d",
  "documentId": "engineering.aaplugin-boundaries",
  "frontMatterFingerprint": "587f4a060e78f6ed0181d47ffc0b5940fa51e694c18440d1aa53e14bc2900eac",
  "sourceFingerprint": "c844f1503af65c0662b7698ab87baf00951382c351f8093aff86f97404157a7d"
}
