{
  "bodyFingerprint": "bb7221c592c21da9072dab8e6c9058554bec5716a063ada7f822c44b838db455",
  "documentId": "package-context.capability-invocation",
  "frontMatterFingerprint": "42c418e78172c977f73db9d260c40156cb81999ba389e9b6360152f3b872d649",
  "sourceFingerprint": "6cbb85fcee5311d81631194786d382544bb3eeea5c0e14b796e7e9942db470d5"
}
