{
  "bodyFingerprint": "8f22ea4a09a636d82e68f684601b0818979efd3fe71bdc51ddca0cad04f1c927",
  "documentId": "package-context.git-evidence",
  "frontMatterFingerprint": "d956e4b1ef939a3b20e8687de09d1d6c06e22823b5f67f0e8e26b7e6e3ed94b6",
  "sourceFingerprint": "e84f34f2953c3aac37c909a21afc946fdbd4ad9a740ef2afcbc4ba9028d5f8ec"
}
