{
  "bodyFingerprint": "03674b73ee049245586b50fe7e2c0c96e4f7c35dd3d220aecd454bce10694f08",
  "documentId": "development-standards.coding-and-comments",
  "frontMatterFingerprint": "5eaf187b342dc27562b6b6a3a44456ca86874d93f8efca0650b31ab9f2cc1069",
  "sourceFingerprint": "b7de873e2789102d6a12838f38a28383df8c14b025c9caccb99e683f04e57ea8"
}
