{
  "bodyFingerprint": "69d8ca35f60321e7965fe3c0ae24c99817d6898e4bf1ed70c220cbdff19c1a84",
  "documentId": "package-context.document-grammar",
  "frontMatterFingerprint": "76a0114fa624812739b89210247135e86a019479809a2d6ed6d4d13fc82aed58",
  "sourceFingerprint": "7b951d0d35dccba961c760d39d2b2bc88fb57e39f332e203a0cfaa44909c42c3"
}
