{
  "bodyFingerprint": "bcefc17b25687362efc48dc9d62bdd0595f3a7d1e7466d63e05775a44e3ae2aa",
  "documentId": "package-context.delta-and-light",
  "frontMatterFingerprint": "34aac1e62ccf3b162ec2f10690ce0a8fcd20c336467663c0f109b0e9149cb8f4",
  "sourceFingerprint": "a7bf5d553055598980a0f8e398214add6f68f52e96d83f408d02f328f3cb5538"
}
