{
  "bodyFingerprint": "1927838594e5dd6d8dc871292c9e9ee3dfa5714905b400e4d1021f6ef3635d52",
  "documentId": "package-context",
  "frontMatterFingerprint": "8c87cd8e3cb7e27fcf6717a5566f829061d3c1926a1741e1debd889a74e7300a",
  "sourceFingerprint": "a03065fc2e3fa2591a6f4036850054e72476e29d9d318ead5fdb241306261fbf"
}
