{
  "bodyFingerprint": "0ea792204c69369a9bc493d9358b1a7e2021fee639163806c536f40e379ee079",
  "documentId": "package-context.determinism",
  "frontMatterFingerprint": "cc984d000cf588a94bd599349743ace50ae9a1cf07b0004bf1f0d42dda9d4ad5",
  "sourceFingerprint": "6be3f7381f6cdb207858a173476ddb0fd63e2425cc575e3bb2c507ddfad343d4"
}
