{
  "bodyFingerprint": "2967eca278dc5e45949da66f2761a42b6047db4481b4fbd024bea69f37475d1c",
  "documentId": "package-context.budgets-and-cursors",
  "frontMatterFingerprint": "e350011b491f69be0116ae09a28781c62a5d2de532aa0bb6eede3bd603d35be8",
  "sourceFingerprint": "8bfb09c1eb0101551dbccd1a453980c3fed92ba22b838cf05226aa7e55d52358"
}
