{
  "bodyFingerprint": "54a4c4d59cc74beb4b8ea41b49879b55364a5a268fee4da647961d9dc62e33e3",
  "documentId": "package-context.outcomes-and-recovery",
  "frontMatterFingerprint": "25a68d10c8213ffad6af556f60d833bb389e87029d925093c3da348d0ae7598d",
  "sourceFingerprint": "cbd97c7fffaa4ef6b49282c5256f689ed3c4ee50f5dc26727df8027e6a6087a6"
}
